{
  "$schema": "https://json-schema.org/draft/2020-12/schema",
  "$id": "schema.simplified.json",
  "title": "Tensile Test — PMDCo (Simplified Input)",
  "description": "A user-friendly form to describe a uniaxial tensile test and its results using the PMDCo measurement pattern. Fill in the specimen IRI, test conditions, and the measured properties. Results are identified by free-text name rather than a fixed vocabulary, so any measured quantity can be recorded.",
  "type": "object",
  "required": ["test_name", "specimen_iri"],
  "additionalProperties": false,
  "properties": {
    "test_name": {
      "title": "Test Name",
      "description": "A human-readable name for this tensile test. Example: 'Tensile test 316L bar 1'.",
      "type": "string",
      "minLength": 1,
      "examples": ["Tensile test 316L bar 1", "RT tensile test AlSi10Mg-A"]
    },
    "test_id": {
      "title": "Test ID",
      "description": "Optional. Identifier (IRI slug) for this test in the RDF graph. Auto-derived from test_name if omitted.",
      "type": "string"
    },
    "description": {
      "title": "Description",
      "description": "Optional free-text description of this test.",
      "type": "string"
    },
    "specimen_iri": {
      "title": "Specimen IRI",
      "description": "The IRI of the specimen being tested.",
      "type": "string",
      "format": "uri",
      "examples": ["https://example.org/specimens/316L-tensile-bar-1"]
    },
    "test_date": {
      "title": "Test Date",
      "description": "Date and time when the test was conducted, in ISO 8601 format (e.g. '2021-05-19T09:36:00').",
      "type": "string",
      "format": "date-time"
    },
    "test_standard": {
      "title": "Test Standard",
      "description": "The standard or norm followed (e.g. 'ISO 6892-1', 'ASTM E8').",
      "type": "string",
      "examples": ["ISO 6892-1", "ASTM E8", "DIN EN ISO 6892-1"]
    },
    "strain_rate": {
      "title": "Strain Rate",
      "description": "Crosshead displacement rate or strain rate during the test.",
      "type": "number",
      "exclusiveMinimum": 0,
      "examples": [0.00025, 0.002]
    },
    "strain_rate_unit": {
      "title": "Strain Rate Unit",
      "description": "Unit for the strain rate value.",
      "type": "string",
      "default": "1/s",
      "examples": ["1/s", "mm/s"]
    },
    "temperature": {
      "title": "Test Temperature",
      "description": "Temperature at which the test was conducted, in °C.",
      "type": "number",
      "examples": [23, -40, 200]
    },
    "gauge_length": {
      "title": "Gauge Length",
      "description": "Extensometer gauge length used during the test (e.g. 80 mm).",
      "type": "number",
      "exclusiveMinimum": 0,
      "examples": [80, 50]
    },
    "gauge_length_unit": {
      "title": "Gauge Length Unit",
      "description": "Unit for the gauge length value.",
      "type": "string",
      "default": "mm"
    },
    "preload": {
      "title": "Pre-load",
      "description": "Pre-load force or stress applied before the test.",
      "type": "number",
      "exclusiveMinimum": 0,
      "examples": [2.0]
    },
    "preload_unit": {
      "title": "Pre-load Unit",
      "description": "Unit for the pre-load value.",
      "type": "string",
      "default": "MPa"
    },
    "results": {
      "title": "Measured Properties",
      "description": "Mechanical properties determined from the test. Add one entry per property.",
      "type": "array",
      "items": {
        "title": "Result Entry",
        "type": "object",
        "required": ["name", "value", "unit"],
        "additionalProperties": false,
        "properties": {
          "name": {
            "title": "Property Name",
            "description": "Human-readable name of the measured property, e.g. 'Yield Strength', 'Tensile Strength', 'Elongation After Fracture'.",
            "type": "string",
            "examples": [
              "Yield Strength",
              "Upper Yield Strength",
              "Tensile Strength",
              "Proof Strength Rp0.2",
              "Elongation After Fracture",
              "Reduction of Area"
            ]
          },
          "value": {
            "title": "Value",
            "description": "Numeric value of the measured property.",
            "type": "number",
            "exclusiveMinimum": 0,
            "examples": [310, 620, 40]
          },
          "unit": {
            "title": "Unit",
            "description": "Unit of the value: 'MPa' or 'GPa' for stress properties, '%' for elongation and reduction of area.",
            "type": "string",
            "enum": ["MPa", "GPa", "%"],
            "default": "MPa"
          }
        }
      },
      "default": []
    }
  },
  "examples": [
    {
      "test_name": "Tensile test 316L bar 1",
      "specimen_iri": "https://example.org/specimens/316L-tensile-bar-1",
      "test_standard": "ISO 6892-1",
      "strain_rate": 0.00025,
      "strain_rate_unit": "1/s",
      "temperature": 23,
      "results": [
        { "name": "Yield Strength",                    "value": 310, "unit": "MPa" },
        { "name": "Tensile Strength",                  "value": 620, "unit": "MPa" },
        { "name": "Elongation After Fracture",         "value": 40,  "unit": "%" },
        { "name": "Reduction of Area",                 "value": 65,  "unit": "%" }
      ]
    }
  ]
}
